{
  "name": "Mars 3 lander",
  "mission_type": "Uncrewed Soft Lander · Частичный успех",
  "site_name": "Прим. 45°S, 158°W (Ptolemaeus Crater)",
  "fact": "Первая мягкая посадка на Марс. Посадочный модуль успешно коснулся поверхности и начал передачу данных — примерно в течение 14–20 секунд. Планетарная пыльная буря, возникшая в момент прибытия, является основным объяснением последовавшего молчания. Несмотря на краткость, Mars 3 доказал возможность мягкой посадки на Марс: этот фундаментальный инженерный результат лёг в основу всех последующих марсианских посадочных модулей.",
  "capability": "Первая успешная маневр входа, снижения и посадки на Марс — доказал, что мягкая посадка была решённой задачей ещё до того, как американская техника попробовала её реализовать."
}
