{
  "name": "Мангалиаан (Мисија орбитера Марса)",
  "mission_type": "Орбитер · Завршено 2022",
  "site_name": "~370 × 80.000 км високо елиптично",
  "fact": "Прва међупланетарна мисија __АЦР0__, са буџетом од ~74 милиона долара — мање од холивудског филма *Гравитација*. Индија је постала прва азијска нација која је стигла на Марс, и прва земља која је то учинила у првом међупланетарном покушају. Радило се 8 година (предвиђено за 6 месеци) пре него што је контакт изгубљен у априлу 2022.",
  "capability": "Демонстриране јефтине међупланетарне мисије; прва азијска мисија на Марс."
}
