{
  "name": "Radoznalost",
  "mission_type": "Bespilotni rover · Aktivan",
  "site_name": "Krater Gale (Aeolis Mons / Mt. Sharp)",
  "fact": "Naučna laboratorija Mars. Rendgenski pogon (bez solarne energije), veličine automobila (899 kg), još uvek u funkciji više od decenije nakon sletanja. Potvrđeno je da je krater Gejl u dubokoj prošlosti bio domaćin naseljivog okruženja jezera. Penjanje na planinu Oštru stratigrafsku sekvencu — čitanje istorije životne sredine Marsa milijardu godina po milijardu godina.",
  "capability": "Prvi Mars rover na nuklearni pogon; prvi koji je potvrdio ranije nastanjivo okruženje na Marsu."
}
