{
  "name": "Lunar Prospector",
  "mission_type": "Orbiteur · Fin 1999",
  "site_name": "Orbite polaire lunaire, 100 km",
  "fact": "Détection directe par spectromètre à neutrons de l'hydrogène aux deux pôles lunaires – preuve solide de la présence de glace d'eau dans les fonds de cratères ombragés en permanence. Délibérément impacté dans le cratère Shoemaker à la fin de la mission, en espérant que l'éjecta d'impact confirmerait l'eau ; Les observateurs terrestres n'ont rien détecté de définitif (un suivi fourni seulement par le LCROSS en 2009).",
  "capability": "Confirmation de l'hypothèse des glaces polaires de Clementine ; a établi la spectroscopie neutronique comme outil principal pour les substances volatiles lunaires."
}
