{
  "name": "MAVEN",
  "mission_type": "활동 중인 궤도 선박 · 2014 – 현재",
  "site_name": "공칭 ~150 × 6,200 km, ~75° 궤도 경사각",
  "fact": "화성 대기 및 휘발성 물질 진화(Mars Atmosphere and Volatile EvolutioN). 화성이 우주로 잃는 대기의 손실 속도를 정량화했습니다 — 태양풍에 의해 박리되는 산소와 CO₂ 약 100 g/s. 화성의 대기 희박화가 약 40억 년 전 화성 전역 자기장의 상실로 인해 야기되었음을 보여주었습니다.",
  "capability": "대기 탈출에 전념하는 첫 번째 임무; 화성이 초기 대기를 어떻게 잃었는지 설명했습니다."
}
