{
  "name": "Mars 6",
  "mission_type": "Aterrizador No Tripulado · Perdido",
  "site_name": "Aprox. 23,9°S, 19,4°O (Margaritifer Sinus)",
  "fact": "Primera nave en devolver datos atmosféricos durante el descenso a Marte. Las comunicaciones se perdieron en el aterrizaje, pero la telemetría de descenso — presión, temperatura y un perfil parcial de composición atmosférica — alimentó los modelos de ingeniería en los que confiaría Viking tres años después.",
  "capability": "Primer perfil atmosférico in situ de Marte durante una EDL — entrada directa en todos los diseños de EDL posteriores."
}
