{
  "name": "Marin 9",
  "mission_type": "Orbiteur actif · Fini en 1972",
  "site_name": "Orbite de Mars, ~1 400 × 17 900 km",
  "fact": "Premier vaisseau spatial à orbiter autour d'une autre planète. Arrivé sur Mars lors d'une tempête de poussière à l'échelle planétaire et attendu que l'atmosphère se dissipe. Renvoie 7 329 images couvrant 100 % de la surface martienne – la première mosaïque globale d’une planète autre que la Terre. Découverte d'Olympus Mons, de Valles Marineris et du terrain en couches polaires.",
  "capability": "La toute première reconnaissance orbitale d’une autre planète a défini le modèle de chaque mission scientifique orbitale ultérieure."
}
