{
  "name": "تشاندرايان-1",
  "mission_type": "مدار · انتهى 2009",
  "site_name": "مدار قطبي قمري، 100 كم",
  "fact": "أول مهمة قمرية هندية. حملت مرقّب المعادن القمري لناسا (M³) — الذي أعاد 2009 أول تأكيد طيفي مباشر لماء (H₂O وOH) منتشرًا على سطح القمر لا عند القطبين فقط. انتهت المهمة بعد 312 يومًا بفقدان الاتصالات؛ تُحلّل بيانات M³ إلى اليوم.",
  "capability": "أول تأكيد عالمي مباشر لماء سطح قمري؛ غيّر كل خارطة طريق لاستخدام الموارد القمرية اللاحقة."
}
