{
  "name": "Curiosity",
  "mission_type": "Onbemande rover · Actief",
  "site_name": "Gale Crater (Aeolis Mons / Mt. Sharp)",
  "fact": "Mars Science Laboratory. RTG-aangedreven (geen zonneafhankelijkheid), autoformaat (899 kg), nog steeds operationeel meer dan een decennium na de landing. Bevestigde dat de Gale Crater in het verre verleden een leefbare meeromgeving herbergde. Klimt over Mt. Sharp's stratigrafische sequentie — miljard-voor-miljard-jaar metingen van Mars' milieugeschiedenis.",
  "capability": "Eerste nucleair aangedreven Mars-rover; eerste die een vroegere leefbare omgeving op Mars bevestigde."
}
